{
  "$schema": "./schema.json",
  "contract_id": "adr-kit.authoring-domain",
  "contract_version": "1.1",
  "contract_family": "authoring_domain",
  "versioning": {
    "independent_of": [
      "canonical_persistence_schema"
    ],
    "successor_of": "1.0",
    "adc_1_0_immutable": true
  },
  "defined_capabilities": [
    "authoring.discovery"
  ],
  "discovery_operations": [
    "describe_contract",
    "list_types",
    "describe_type"
  ],
  "type_kinds": [
    "adr",
    "entity",
    "relationship",
    "value"
  ],
  "read_only_boundary": {
    "posture": "descriptive_only",
    "public_binding_support": false,
    "advertised_authoring_domain_version": "1.0",
    "construction_execution": "not_implemented",
    "future_execution_authority": "authoring_construction_contract/1.0",
    "excluded_operations": [
      "construct_authoring_set",
      "validate_authoring",
      "persist_authoring",
      "reserve_alias",
      "admit_governance"
    ],
    "statement": "This artifact closes construction-facing descriptive policy; it does not execute construction or advertise successor binding support."
  },
  "policy_vocabulary": {
    "policy_status": [
      "defined",
      "not_applicable"
    ],
    "relationship_modes": [
      "explicit",
      "composition_derived",
      "field_derived",
      "compatibility_projection",
      "custom_explicit"
    ],
    "operation_permissions": [
      "allowed",
      "proposed_only",
      "unsupported",
      "qualified_contract_required",
      "future_custom_entity_contract_required"
    ],
    "identity_modes": [
      "canonical_uuidv7",
      "owner_local",
      "owner_local_relationship_value",
      "custom_contract_qualified",
      "none"
    ],
    "ordering_modes": [
      "source_declared_sequence",
      "identity_keyed_set",
      "owner_declared_sequence",
      "custom_contract_declared",
      "not_applicable"
    ]
  },
  "discovery_projections": {
    "describe_contract": {
      "response": {
        "fields": [
          "contract_id",
          "contract_version",
          "defined_capabilities",
          "discovery_operations",
          "type_kinds"
        ]
      }
    },
    "list_types": {
      "request": {
        "kind": {
          "presence": "optional",
          "matching": "exact",
          "case_sensitive": true,
          "allowed_values": [
            "adr",
            "entity",
            "relationship",
            "value"
          ]
        }
      },
      "response": {
        "fields": [
          "contract_version",
          "types"
        ],
        "item_type": "AuthoringTypeSummary",
        "item_fields": [
          "key",
          "display_name",
          "description"
        ]
      },
      "ordering": {
        "deterministic": true,
        "by": [
          "key.kind",
          "key.name"
        ]
      },
      "filter": {
        "request_field": "kind",
        "response_echoed": false
      }
    },
    "describe_type": {
      "request": {
        "fields": [
          {
            "name": "kind",
            "required": true,
            "matching": "exact",
            "case_sensitive": true
          },
          {
            "name": "name",
            "required": true,
            "matching": "exact",
            "case_sensitive": true
          },
          {
            "name": "contract_version",
            "required": false,
            "matching": "exact",
            "case_sensitive": true
          }
        ]
      },
      "response": {
        "type": "AuthoringTypeDescriptor"
      }
    }
  },
  "types": [
    {
      "contract_version": "1.1",
      "key": {
        "kind": "adr",
        "name": "logical"
      },
      "display_name": "Logical ADR",
      "description": "Construction-aware descriptive contract for Logical ADR.",
      "authoring_mode": "direct",
      "semantic_type_ownership": "adr_kit",
      "discriminator": {
        "mode": "fixed",
        "field": "adr_type",
        "value": "logical"
      },
      "construction_support": {
        "status": "described",
        "fragment_kind": "composite_fragment",
        "execution": "not_implemented",
        "result": "detached_candidate_only"
      },
      "input_contract": {
        "status": "defined",
        "shape": "exact_typed_root",
        "authority": "explicit_typed_intent",
        "required_fields": [
          "adr_type",
          "id",
          "alias_id",
          "alias_name",
          "title"
        ],
        "optional_fields": [],
        "unknown_fields": "reject",
        "inference": "forbidden"
      },
      "identity_policy": {
        "status": "defined",
        "mode": "canonical_uuidv7",
        "identity_bearing": true,
        "establishment": "create",
        "supplied_identity": "preserve",
        "update_identity": "preserve",
        "reference_identity": "reuse",
        "composition_identity": "does_not_manufacture",
        "forbidden_derivations": [
          "alias",
          "prose",
          "path",
          "source_location",
          "hash",
          "ordering",
          "composition_position"
        ]
      },
      "composition_policy": {
        "status": "defined",
        "mode": "root_fragment",
        "allowed_parents": [],
        "cardinality": "root",
        "child_identity": "preserve",
        "admission": "deferred",
        "persistence": "deferred"
      },
      "reference_policy": {
        "status": "defined",
        "mode": "canonical_uuidv7",
        "allowed_reference_kinds": [
          "canonical_entity",
          "adr"
        ],
        "reference_field_contract": {
          "fields": [
            "id",
            "alias_id",
            "alias_ref"
          ],
          "endpoint_representation": "canonical_uuidv7"
        },
        "unresolved": "preserve_explicit_unresolved",
        "identity_effect": "reference_does_not_recreate_identity"
      },
      "field_ownership_policy": {
        "status": "defined",
        "owner": "adr_kit",
        "semantic_fields": [
          "type-specific semantic fields"
        ],
        "identity_fields": [
          "id"
        ],
        "provenance_fields": [
          "declaring_owner",
          "source_contract"
        ],
        "extension_fields": "none",
        "unknown_fields": "reject"
      },
      "relationship_policy": {
        "status": "defined",
        "semantic_owner": "adr_kit",
        "relationship_mode": "explicit",
        "allowed_outbound": [],
        "allowed_inbound": [],
        "relationship_field_contract": {
          "fields": [],
          "endpoint_representation": "none"
        },
        "cardinality": "no_relationship_participation_declared",
        "ordering": {
          "status": "defined",
          "mode": "not_material",
          "material": false,
          "rule": "no undeclared relationship sequence"
        }
      },
      "operation_posture": {
        "create": {
          "status": "defined",
          "permission": "proposed_only"
        },
        "update": {
          "status": "defined",
          "permission": "proposed_only"
        },
        "reference": {
          "status": "defined",
          "permission": "allowed"
        },
        "retire": {
          "status": "defined",
          "permission": "unsupported"
        }
      },
      "ordering_policy": {
        "status": "defined",
        "mode": "source_declared_sequence",
        "material": true,
        "rule": "preserve authored fragment sequence"
      }
    },
    {
      "contract_version": "1.1",
      "key": {
        "kind": "adr",
        "name": "physical-component"
      },
      "display_name": "Physical-Component ADR",
      "description": "Construction-aware descriptive contract for Physical-Component ADR.",
      "authoring_mode": "direct",
      "semantic_type_ownership": "adr_kit",
      "discriminator": {
        "mode": "fixed",
        "field": "adr_type",
        "value": "physical-component"
      },
      "construction_support": {
        "status": "described",
        "fragment_kind": "composite_fragment",
        "execution": "not_implemented",
        "result": "detached_candidate_only"
      },
      "input_contract": {
        "status": "defined",
        "shape": "exact_typed_root",
        "authority": "explicit_typed_intent",
        "required_fields": [
          "adr_type",
          "id",
          "alias_id",
          "alias_name",
          "title"
        ],
        "optional_fields": [],
        "unknown_fields": "reject",
        "inference": "forbidden"
      },
      "identity_policy": {
        "status": "defined",
        "mode": "canonical_uuidv7",
        "identity_bearing": true,
        "establishment": "create",
        "supplied_identity": "preserve",
        "update_identity": "preserve",
        "reference_identity": "reuse",
        "composition_identity": "does_not_manufacture",
        "forbidden_derivations": [
          "alias",
          "prose",
          "path",
          "source_location",
          "hash",
          "ordering",
          "composition_position"
        ]
      },
      "composition_policy": {
        "status": "defined",
        "mode": "root_fragment",
        "allowed_parents": [],
        "cardinality": "root",
        "child_identity": "preserve",
        "admission": "deferred",
        "persistence": "deferred"
      },
      "reference_policy": {
        "status": "defined",
        "mode": "canonical_uuidv7",
        "allowed_reference_kinds": [
          "canonical_entity",
          "adr"
        ],
        "reference_field_contract": {
          "fields": [
            "id",
            "alias_id",
            "alias_ref"
          ],
          "endpoint_representation": "canonical_uuidv7"
        },
        "unresolved": "preserve_explicit_unresolved",
        "identity_effect": "reference_does_not_recreate_identity"
      },